{
  "format": "aegisops-collector-v1",
  "collector_id": "local-kind-reader",
  "cluster_id": "kind-aegisops-demo",
  "registration_id": "11111111-1111-4111-8111-111111111111",
  "public_key": "fd89aef0320ad483d3b97785972834f8b5a431307e23e56a37194c6b29b1a25f",
  "key_id": "5255da8abecab8218d451bd5a866e66e4b76e44b2d1a11f8856d1ed6145b255c"
}
